<?xml version="1.0" encoding="UTF-8"?>
<?xml-stylesheet type="text/xsl" href="stylesheet/games.xsl"?>
<!--
    Document   : games.xml
    Created on : June 6, 2013, 6:45 AM
    Author     : Quaikiet
    Description:
        Purpose of the document follows.
-->

<games  xmlns:xsi='http://www.w3.org/2001/XMLSchema-instance'
   xmlns='http://xml.netbeans.org/schema/games'
   xsi:schemaLocation='http://xml.netbeans.org/schema/games games.xsd'>
    <Game>
        <GameId>1</GameId>
        <Name>Dota</Name>
        <Price>9.9</Price>
        <Pinboard>ASD</Pinboard>
        <Description>DSA</Description>
        <Image_URL>asdzc</Image_URL>
        <CreatedDate>2002-09-24T11:12:12</CreatedDate>
    </Game>

</games>
